"Story","Title","Result","Date","Stability","Duration (s)"
"GE-1 - Breadcrumbs","VIR-115.03 Verify that the breadcrumb conventions are determined by site taxonomy","PENDING","2017-08-11T14:08:16.430+03:00","0.0","0.0"
"GE-1 - Breadcrumbs","VIR-115.04 Verify that the breadcrumb is shown below main menu","PENDING","2017-08-11T14:08:16.509+03:00","0.0","0.0"
"GE-1 - Breadcrumbs","VIR-115.06 Verify that the breadcrumb nodes are separated by ""/""","PENDING","2017-08-11T14:08:16.628+03:00","0.0","0.0"
"GE-9 - Service Level Global Header","VIR-252.01 Verify that the service level is shown to the shopper","PENDING","2017-08-11T14:08:18.623+03:00","0.0","0.0"
"GE-9 - Service Level Global Header","VIR-252.02 Verify that the shopper can change the service level","PENDING","2017-08-11T14:08:18.735+03:00","0.0","0.0"
"GE-9 - Service Level Global Header","VIR-252.03 Verify that proper pricing is reflected from the service level change.","PENDING","2017-08-11T14:08:18.951+03:00","0.0","0.0"
"GE-10 - Order Tracking Page Link","VIR-253.01 Verify that the order tracking link is shown to the shopper near My Account","PENDING","2017-08-11T14:08:15.498+03:00","0.0","0.0"
"GE-10 - Order Tracking Page Link","VIR-253.02 Verify that the tracking information is shown on the new page by clicking on the link","PENDING","2017-08-11T14:08:15.599+03:00","0.0","0.0"
"GE-13 - Global Search/Contract","VIR-256.02 Verify that the contract is shown next after search bar on the header","PENDING","2017-08-11T14:08:15.946+03:00","0.0","0.0"
