"Story","Title","Result","Date","Stability","Duration (s)"
"LGN-3 - Password Reset","VIR-507.01 Create new user in the Backoffice","ERROR","2017-08-11T14:08:20.367+03:00","0.0","0.08"
"LGN-3 - Password Reset","VIR-507.02-03 Verify that the shopper is able to open change password modal window by clicking in the corresponding link","ERROR","2017-08-11T14:08:20.460+03:00","0.0","0.07"
"LGN-3 - Password Reset","VIR-507.04 Verify that the email is sent to the shopper on changing password with the reset link","ERROR","2017-08-11T14:08:20.555+03:00","0.0","0.09"
"LGN-3 - Password Reset","VIR-507.05 Verify that the shopper can enter new password on the reset link","ERROR","2017-08-11T14:08:20.663+03:00","0.0","0.05"
"LGN-3 - Password Reset","VIR-507.06 Verify that the shopper can login to the system with the new password","ERROR","2017-08-11T14:08:20.729+03:00","0.0","0.1"
"LGN-3 - Password Reset","VIR-507.07 Verify the password creation validation rules","ERROR","2017-08-11T14:08:20.864+03:00","0.0","0.1"
